{
  "$schema": "https://json-schema.org/draft/2020-12/schema",
  "$id": "https://example.com/e3d-pilot.config.schema.json",
  "title": "e3d-pilot target repo config",
  "type": "object",
  "additionalProperties": false,
  "required": [
    "verify",
    "protected_paths",
    "research_topics",
    "pr",
    "providers",
    "max_diff_files",
    "max_diff_lines"
  ],
  "properties": {
    "verify": {
      "type": "array",
      "items": { "type": "string" },
      "default": []
    },
    "protected_paths": {
      "type": "array",
      "items": { "type": "string" },
      "default": []
    },
    "research_topics": {
      "type": "string"
    },
    "analogy_domains": {
      "type": "array",
      "items": { "type": "string" }
    },
    "pr": {
      "type": "object",
      "additionalProperties": false,
      "required": ["base_branch", "draft", "labels", "backend"],
      "properties": {
        "base_branch": { "type": "string" },
        "draft": { "type": "boolean" },
        "labels": {
          "type": "array",
          "items": { "type": "string" },
          "default": []
        },
        "backend": {
          "type": "string",
          "enum": ["auto", "github", "local"]
        }
      }
    },
    "providers": {
      "type": "object",
      "additionalProperties": false,
      "required": ["discover", "ideate", "draft", "negotiate", "review"],
      "properties": {
        "discover": {
          "oneOf": [
            { "type": "string" },
            { "type": "array", "minItems": 1, "items": { "type": "string" } }
          ]
        },
        "ideate": {
          "oneOf": [
            { "type": "string" },
            { "type": "array", "minItems": 1, "items": { "type": "string" } }
          ]
        },
        "draft": { "type": "string" },
        "negotiate": {
          "type": "array",
          "minItems": 1,
          "items": { "type": "string" }
        },
        "review": {
          "oneOf": [
            { "type": "string" },
            { "type": "array", "minItems": 1, "items": { "type": "string" } }
          ]
        },
        "execute": {
          "type": "string",
          "enum": ["s2c", "grok-build"],
          "default": "s2c"
        }
      }
    },
    "max_diff_files": {
      "type": "integer",
      "minimum": 0
    },
    "max_diff_lines": {
      "type": "integer",
      "minimum": 0
    },
    "docs": {
      "type": "string"
    },
    "execute_local_data_paths": {
      "type": "array",
      "items": { "type": "string" },
      "default": []
    },
    "live_verify": {
      "type": "object",
      "additionalProperties": false,
      "required": ["command"],
      "properties": {
        "command": {
          "type": "string"
        }
      }
    },
    "notify": {
      "type": "object",
      "additionalProperties": false,
      "properties": {
        "email": {
          "type": "object",
          "additionalProperties": false,
          "required": ["to"],
          "properties": {
            "to": { "type": "string" },
            "command": { "type": "string" }
          }
        }
      }
    },
    "approval": {
      "type": "object",
      "additionalProperties": false,
      "required": ["implementation_required", "merge_required"],
      "properties": {
        "implementation_required": { "type": "boolean" },
        "merge_required": { "type": "boolean" }
      }
    },
    "tracking": {
      "type": "object",
      "additionalProperties": false,
      "properties": {
        "project_url": { "type": "string" }
      }
    },
    "candidate_scoring": {
      "type": "object",
      "additionalProperties": false,
      "required": ["provider"],
      "properties": {
        "provider": { "type": "string" },
        "workers": {
          "type": "integer",
          "minimum": 3,
          "maximum": 5,
          "default": 3
        }
      }
    }
  }
}
