{
  "verify": [
    "npm test"
  ],
  "protected_paths": [
    ".github/workflows/**",
    "deploy/**",
    "secrets/**"
  ],
  "research_topics": "AI video generation, wallet-paid APIs",
  "pr": {
    "base_branch": "main",
    "draft": true,
    "labels": ["e3d-pilot"],
    "backend": "auto"
  },
  "providers": {
    "discover": "devin",
    "ideate": "devin",
    "draft": "codex",
    "negotiate": ["devin", "codex"],
    "review": "devin",
    "execute": "s2c"
  },
  "max_diff_files": 25,
  "max_diff_lines": 600,
  "docs": "AGENTS.md",
  "live_verify": {
    "command": "npx e3d-agent pod2vid render --transcript ./sample.txt --wait"
  },
  "approval": {
    "implementation_required": true,
    "merge_required": true
  }
}
